Partner Type,Local District,Organization/ Agency,Contact Link,Address,Full Address,City,Zip code,Phone number,Description,id,lon,lat
Food Resources,All,World Harvest Food Bank,https://www.worldharvestla.org/,3100 Venice Blvd.,"3100 Venice Blvd., Los Angeles, 90019",Los Angeles,90019,(213) 746-2227,"Mon. - Fri. : 8:00 am - 6:00 pm, Sat. 8:00 am - 3:00 pm. There is a charge of $40.00 for over $200.00 worth of groceries where clients are able to choose from. Recipients must bring and ID, utility bill, and proof of residence.",2,-118.3181121,34.0432414
Food Resources,C,All Peoples Community Center,N/A,822 E. 20th St.,"822 E. 20th St., Los Angeles, 90011",Los Angeles,90011,(213) 747-6357,Food pantry day and hours: Fridays: 9:30 am - 1:00 pm. Must bring ID.,3,-118.256591,34.0257438
Food Resources,C,American Veteran Inc.,N/A,351 East Temple St,"351 East Temple St, Los Angeles, 90012",Los Angeles,90012,(909) 534-5953,Must call and schedule an appointment for pickup.,4,-118.2385001,34.0520292
Food Resources,C,Brownson House Community Services Center,https://locator.lacounty.gov/lac/Location/3176351/catholic-charities-of-los-angeles---brownson-house,1307 Warren St.,"1307 Warren St., Los Angeles, 90033",Los Angeles,90033,(213) 251-3512,Food pantry days and hours: Mon-Fri: 9:00 am - 1:00 pm. Must provide a picture ID.,5,-118.2201788,34.0520689
Food Resources,C,Central City Neighborhood Partners,https://www.laccnp.org/who-we-are.php,501 S. Bixel St.,"501 S. Bixel St., Los Angeles, 90017",Los Angeles,90017,(213) 482-8618,"Food pantry days and hours: Thursday: 9:00 am - 1:00 pm, or until food runs out. ID is not required, but preferred.",6,-118.2618214,34.0548809
Food Resources,C,Central City Neighborhood Partners,N/A,501 South Bixel St,"501 South Bixel St, Los Angeles, 90017",Los Angeles,90017,(213) 482-8618,"Thurs: 9:00 a.m. - 1:00 p.m.. First come, first served.",7,-118.2618214,34.0548809
Food Resources,C,Charismatic Evangelical Ministries,N/A,439 S. Western Ave.,"439 S. Western Ave., Los Angeles, 90020",Los Angeles,90020,(213) 219-3228,"Food Pantry days and hours: 1st, 2nd, & 3rd Sunday from 1:00 pm - 2:00 pm. Senior only distribution on LAST Sunday from 1:00 pm - 2:00 pm. No ID is required at this time.",8,-118.3094961,34.066015
Food Resources,C,Children's Hospital Los Angeles,https://www.chla.org/,5000 Sunset Blvd. 7th Fl.,"5000 Sunset Blvd. 7th Fl., Los Angeles, 90027",Los Angeles,90027,(323) 361-5981,Food pantry day and hours: Wednesdays: 10:00 am - 11:00 am. Please bring your own bags.,9,-118.2986129,34.0978447
Food Resources,C,Children's Hospital Los Angeles,https://www.chla.org/,"5000 Sunset Blvd, 7th Floor","5000 Sunset Blvd, 7th Floor, Los Angeles, 90027",Los Angeles,90027,(323) 361-5981,Wed: 10:00 a.m. - 11:00 a.m.. Bring your own bags.,10,-118.2986129,34.0978447
Food Resources,C,Christian Food Center,http://www.christianfood.org/,1355 E. Washington Blvd,"1355 E. Washington Blvd, Los Angeles, 90021",Los Angeles,90021,(213) 716-9115,"Tues-Fri: 9:00 a.m. - 3:30 p.m., and Sat: 9:00 a.m. - 12:00 p.m. This is not an in-kind pantry. Please bring $30.00 dollar donation for 250 pounds of groceries.",11,-118.2487564,34.0237527
Food Resources,C,Downtown Women's Center,https://www.downtownwomenscenter.org/,442 S. San Pedro St.,"442 S. San Pedro St., Los Angeles, 90011",Los Angeles,90011,(213) 225-8032,"Meals, clothing, housing assistance. They are also available online. Grab and Go meals daily from 9:00 am - 9:30 am to women distributed through a gate.",12,-118.2432057,34.0446522
Food Resources,C,DREAM Center,https://www.dreamcenter.org/,2301 Bellvue Ave,"2301 Bellvue Ave, Los Angeles, 90026",Los Angeles,90026,(213) 273-7000,"FREE MEALS (Breakfast, Lunch & Dinner) for all LAUSD students starting March 16th, 2020.",13,-118.269153,34.0745204
Food Resources,C,Epiphany Episcopal Church,NA,2808 Altura St.,"2808 Altura St., Los Angeles, 90031",Los Angeles,90031,(323) 227-9931,Food distribution day and hours: 2nd and 4th Friday of the month: 10:30 am - until supplies last.,14,-118.212868,34.0752644
Food Resources,C,Estrella Del Mar De Los Angeles - Regis House Community Center,https://www.regishousecommunitycenter.org/,2212 Beverly Blvd,"2212 Beverly Blvd, Los Angeles, 90057",Los Angeles,90057,(213) 380-8168,Food pantry day and hours: 2nd and 4th Thursday of the month: 10:00 am - 11:00 am. Please bring a valid ID and bags.,15,-118.271985,34.0670916
Food Resources,C,First Southern Baptist Church of Hollywood,N/A,1528 N. Wilton Place,"1528 N. Wilton Place, Los Angeles, 90028",Los Angeles,90028,(323) 466-9631,Food pantry day and hours: Mondays: 9:30 am - until supplies last. Fridays: 5:00 pm - 6:00 pm. Must start lining up at 4:00 pm and bring your own bags.,16,-118.3132449,34.0991321
Food Resources,C,Immanuel Presbyterian Church,https://immanuelpres.org/,668 S. Catalina St.,"668 S. Catalina St., Los Angeles, 90005",Los Angeles,90005,(213) 389-3191,Food Pantry days and hours: Mon-Sat: 8:00 am - 12:00 pm. ID is not required.,17,-118.295258,34.0610688
Food Resources,C,Living Truth Christian Fellowship,https://foodoasis.la/food-pantry/living-truth-christian-fellowship/,5873 Normandie Ave.,"5873 Normandie Ave., Los Angeles, 90044",Los Angeles,90044,(323) 290-3909,NA,18,-118.3003763,33.987706
Food Resources,C,Silver Lake Community Church,http://www.thesilverlakechurch.net/,2930 Hyperion Avenue,"2930 Hyperion Avenue, Los Angeles, 90010",Los Angeles,90010,(323)-663-3151,Call for more information.,19,-118.2704656,34.1097407
Food Resources,C,St Francis Center,https://www.stfranciscenterla.org/,1835 S. Hope St,"1835 S. Hope St, Los Angeles, 90015",Los Angeles,90015,(213) 747-5347,"Meal services, clothing closets, showers/bathroom services, and rental and utility assistance programs (over the phone) for homeless and low-income individuals in Los Angeles. Food Pantry hours are: Wed. Thurs., & Sat. 10:30 am - 12 pm. Registration or documentation is not required at this time.",20,-118.2697925,34.0340212
Food Resources,C,St. James Episcopal Church,https://stjla.org/,3903 Wilshire Blvd.,"3903 Wilshire Blvd., Los Angeles, 90010",Los Angeles,90010,(323) 934-5870,Food Pantry is open Thursdays from 8:00 am - 9:00 am. No ID is required at this time.,21,-118.3120852,34.0620373
Food Resources,C,Wilshire Presbyterian Church,http://wilshirepres.org/Home_Page.php,309 S. Oxford Ave.,"309 S. Oxford Ave., Los Angeles, 90020",Los Angeles,90020,(213) 387-5387,Food Pantry is open Mondays: 8:00 am - unitl food runs out. No ID is required at this time.,22,-118.3081806,34.0686339
Food Resources,E,Bienestar East Los Angeles,N/A,5326 East Beverly Blvd,"5326 East Beverly Blvd, Los Angeles, 90022",Los Angeles,90022,(323) 727-7896,Food pantry days and hours: Tuesday: 11:00 am - 12:00 pm; Wednesday: 10:00 am - 12:00pm; & Thursday: 12:00 pm - 4:00 pm. Must be HIV positive and live be a resient of East Los Angeles.,23,-118.1506226,34.0300336
Food Resources,E,Church of the Epiphany,N/A,2802 Altura St.,"2802 Altura St., Los Angeles, 90031",Los Angeles,90031,(323) 227-9931,Next food pantry date is 4/24/20 at 8:30 am until supplies last.,24,-118.2130597,34.0752488
Food Resources,E,Door of Hope Community Center,N/A,1414 South Atlantic Blvd,"1414 South Atlantic Blvd, Los Angeles, 90022",Los Angeles,90022,(323) 262-2777,Thurs: 9:00 a.m. - 11:00 a.m.. Call ahead and arrive early.,25,-118.1590196,34.012313
Food Resources,E,Downey First Christian Church,http://downeyfirst.org/,10909 New St.,"10909 New St., Downey, 90241",Downey,90241,(562) 862-2438,"Saturdays 9:00 am -12:00 pm. Walk in service available. Food distribution takes place in their Cafe Building at 10900 Lorena Ave., Downey. No ID or documentation required at this time.",26,-118.1322518,33.9430677
Food Resources,E,East LA Temple Salvation Army,https://eastla.salvationarmy.org/east_los_angeles_corps/,140 N Eastman Ave.,"140 N Eastman Ave., Los Angeles, 90063",Los Angeles,90063,(323) 263-7577,Mon. -Fri. : 9:00 am - 3:30 pm. ID is required.,27,-118.1854499,34.0369244
Food Resources,E,Food Net- Centro Maravilla,https://foodoasis.la/food-pantry/food-net-centro-maravilla/,4716 East Cesar Chavez Avenue,"4716 East Cesar Chavez Avenue, Los Angeles, 90022",Los Angeles,90022,(323) 260-2805,"Food pantry days and hours: Mon, Tues, Thurs, & Fri: 9:00 am - 4:30 pm. Must call in advance and make an appointment. Diapers are also available subject to availability.",28,-118.1644721,34.0403342
Food Resources,E,Gloria Molina YMCA Food Distribution,https://ywcagla.org/what-we-do/empowerment-sites/,7515 Pacific Blvd.,"7515 Pacific Blvd., Walnut Park, 90255",Walnut Park,90255,(213) 516-3575,Elderly meal distribution program. Call for information.,29,-118.225517,33.971112
Food Resources,E,Los Angelitos Bakery,N/A,2881 E Florence Ave,"2881 E Florence Ave, Huntington Park, 90255",Huntington Park,90255,(323) 587-2253,"Offering 1 FREE BREAD to per child, ages 5-13yrs old throughout LAUSD closure. More information on their Instagram page. Mon. - Fri.: 12 pm. - 2 pm. Must bring kids along, but they can stay outside as long as they can see the kids.",30,-118.2178714,33.973646
Food Resources,E,Our Lady Queen of Angels Catholic Church,http://laplacita.org/,"535 North Main Street, (cross street- Cesar Chavez)","535 North Main Street, (cross street- Cesar Chavez), Los Angeles, 90012",Los Angeles,90012,(213) 629-3101,Call for more information.,31,-118.239577,34.05707
Food Resources,E,Salvation Army,https://southeastcommunities.salvationarmy.org/,2965 E Gage Ave.,"2965 E Gage Ave., Huntington Park, 90255",Huntington Park,90255,(323) 587-4221,Non-perishable food; call first.,32,-118.2163864,33.9814472
Food Resources,E,South East Churches Service Center,https://www.211la.org/211search/more?site_id=1034259001,7600 State St.,"7600 State St., Huntington Park, 90255",Huntington Park,90255,(323) 585-8254,Also utility assistance by appointment: Mon. & Thurs. 9:00 am - 12:00 pm. and 1:00 pm - 3:00 pm. No longer providing food assistance at this time.,33,-118.209581,33.9691339
Food Resources,Various,A.V. Living Water Worship Center,https://lwwcofav.org/,111 West Avenue L-12,"111 West Avenue L-12, Lancaster, 93535",Lancaster,93535,(661) 313-6240,Mon-Thurs: 1:00 p.m. - 2:00 p.m. Sat: 10:45 a.m. - 1:00 p.m.,34,-118.1509815,34.6489107
Food Resources,Various,Bethany Church,N/A,17054 Bixby Avenue,"17054 Bixby Avenue, Bellflower, 90706",Bellflower,90706,(562) 866-1812,Distribution Tues: 2:00 p.m. - 3:00 p.m.. Sack lunches Wed: 4:00 p.m. - 4:30 p.m. No ID required.,35,-118.1205429,33.8787135
Food Resources,Various,Catholic Charities Of Los Angeles-San Pedro,https://catholiccharitiesla.org/,123 E. 14th St.,"123 E. 14th St., Long Beach, 90813",Long Beach,90813,(213) 251-3432,Food pantry days and hours: Tues & Thurs: 9:30 am - 12:00 pm & 1:30 pm - 3:00 pm. Service is available to Long Beach residents only.,36,-118.1916422,33.784066
Food Resources,Various,Catholic Charities of Los Angeles-St. Margaret's Center,https://catholiccharitiesla.org/,10217 Inglewood Ave,"10217 Inglewood Ave, Lennox, 90304",Lennox,90304,(310) 672-2208,By appointment only. Please call Monday: 8:30 am - 12:00 pm and 1:00 pm - 5:00 pm to make an appointment for Wednesdayfood distribution.,37,-118.3618318,33.9430344
Food Resources,Various,Chicana Worship Center,N/A,42640 10th Street West,"42640 10th Street West, Lancaster, 93534",Lancaster,93534,(661) 940-8378,Distribution every 3rd Saturday of each month: 10:00 a.m.-12:00 p.m.. Valid ID needed and must bring own bags. Call ahead of time.,38,-118.1471819,34.6579322
Food Resources,Various,Christian Outreach In Action,http://www.coalongbeach.org/,515 E. 3rd St.,"515 E. 3rd St., Long Beach, 90802",Long Beach,90802,(562) 432-1440,Food pantry days and hours: Tues & Thurs: 9:00 am - 12:00 pm. No ID required. Please bring your own bags. Grab and Go breakfast: Mon-Sun: 7:00 am. Grab and Go dinner: Mon-Fri: 4:30 pm.,39,-118.186108,33.7707206
Food Resources,Various,Cory's Kitchen Irwindale,https://www.shepherdspantry.com/locations-services/,1418 Arrow Highway,"1418 Arrow Highway, Irwindale, 91706",Irwindale,91706,(626) 305-0392,Tues: 4:00 p.m. - 7:00 p.m.. Drive thru option. Must provide picture ID.,40,-117.9746909,34.1146127
Food Resources,Various,First Baptist Church Of Long Beach,https://www.fbclb.org/,1000 Pine Ave.,"1000 Pine Ave., Long Beach, 90813",Long Beach,90813,(562) 432-8447,Food pantry day and hours are Mondays: 9:30 am - 11:00 am. Food pantry service is for Long Beach residents only. ID required.,41,-118.1920306,33.7800148
Food Resources,Various,Grace Resouce Center,https://www.graceresources.org/,45134 Sierra Hwy,"45134 Sierra Hwy, Lancaster, 93534",Lancaster,93534,(661) 940-5272,Distribution for Spanish Speaking individuals on Wed. at 10:00 a.m.. English Speaking individuals Tues. & Thurs. 10:00 a.m. - 1:00 p.m.. Hot meals served Wed. & Fri. 5:30 p.m. and Sun. 1:30 p.m..,43,-118.1374762,34.7029441
Food Resources,Various,Grateful Hearts,https://gratefulhearts.org/,5420 Katella Ave,"5420 Katella Ave, Los Alamitos, 90720",Los Alamitos,90720,(562) 431-0880,"Must call and schedule an appointment for pickup. Food distribution days and hours: Wed, Thurs, & Sat: 8:00 am - 3:00 pm.",44,-118.0381404,33.8025951
Food Resources,Various,Hawaiian Gardens Food Bank,http://hawaiiangardensfoodbank.com/,22121 Norwalk Blvd,"22121 Norwalk Blvd, Hawaiian Gardens, 90716",Hawaiian Gardens,90716,(562) 860-9097,Food pantry days and hours: Wednesday: 2:00 pm - 6:00 pm and Thursday: 9:30 am - 3:30 pm.,45,-118.0721441,33.8270963
Food Resources,Various,Help Me Help You- Philadephian SDA Church,https://www.helpmehelpu.org/,2640 Sante Fe Ave.,"2640 Sante Fe Ave., Long Beach, 90810",Long Beach,90810,(562) 612-5001,Food pantry days and hours: 2nd and 4th Wednesday of the month: By appointment only.,46,-118.2150931,33.8052212
Food Resources,Various,Help Me Help You- Stevenson Elementary School,https://www.helpmehelpu.org/,515 Lime Ave,"515 Lime Ave, Long Beach, 90802",Long Beach,90802,(562) 612-5001,Food pantry days and hours: 1st and 3rd Friday the month: 1:30 pm - 2:30 pm. No ID required.,47,-118.1839875,33.7738153
Food Resources,Various,Hope in Action,N/A,2420 Pacific Coast Highway,"2420 Pacific Coast Highway, Hermosa Beach, 90254",Hermosa Beach,90254,(310) 374-4673,"Wed & Fri: 9:00 a.m. - 12:00 p.m., & 1:00 p.m. - 4:00 p.m. Food distribution is only for South Bay residents only.",48,-118.3947754,33.8716927
Food Resources,Various,Inglewood Southside Christian,https://isschristian.org/,3947 West 10th St,"3947 West 10th St, Inglewood, 90303",Inglewood,90303,(310) 677-0446,"2nd Sat. of the month, 10:00 a.m. - 12:00 p.m. or until supplies last. Must provide proof of address.",49,-118.3433298,33.9359953
Food Resources,Various,Inland Valley Hope Partners - Claremont,http://www.inlandvalleyhopepartners.org/,660 North Mountain Avenue,"660 North Mountain Avenue, Claremont, 91711",Claremont,91711,(909) 622-3806,"Mon-Thurs: 9:00 a.m. - 2:30 p.m.. Must provide photo ID for every household member, proof of income, and proof of address.",50,-117.728539,34.099539
Food Resources,Various,Loaves and Fishes- Glendale,https://foodoasis.la/food-pantry/loaves-fishes-glendale/,4322 San Fernando Rd.,"4322 San Fernando Rd., Glendale, 91204",Glendale,91204,(213) 318-5707,"Food pantry days and hours: Mon, Tues, Wed, & Fri: 10:00 am - 1:30 pm. Must provide ID, proof of income and address, along with birth certificates of each child in household.",51,-118.2609307,34.131613
Food Resources,Various,Lutheran Social SVCS,https://www.lsssc.org/location/south-bay-long-beach/,1611 Pine Ave.,"1611 Pine Ave., Long Beach, 90813",Long Beach,90813,(562) 599-1321,"Food Pantry days and hours: Mon, Tues, & Thurs: 10:00 am - 2:00 pm and Wed: 11:00 am - 2:00 pm. Service is for South Bay and Long Beach residents only. Please bring ID and proof of all of the people living in the household.",52,-118.1927324,33.7874667
Food Resources,Various,Mexican-American Opportunity Foundation,http://www.maof.org/maof-food-bank/,401 North Garfield Ave,"401 North Garfield Ave, Montebello, 90640",Montebello,90640,(323) 890-9600,Food pantry day and hours: Thursday: 9:00 a.m. - 1:00 p.m.. Must provide ID.,53,-118.1337091,34.0191654
Food Resources,Various,NOLP / Claremont Foothill AIDS Project,https://aplahealth.org/services/nolp-food-pantries-nutrition/,233 West Harrison Ave,"233 West Harrison Ave, Claremont, 91711",Claremont,91711,(213) 201-1600,2nd Wednesday of the month from 2:00 p.m. - 4:00 p.m.. Must be HIV+ and enrolled in the program.,55,-117.7530956,34.0993921
Food Resources,Various,NOLP / Lancaster Tarzana Treatment Center,https://aplahealth.org/services/nolp-food-pantries-nutrition/,320 East Palmdale Blvd,"320 East Palmdale Blvd, Palmdale, 93350",Palmdale,93350,(213) 201-1600,Open 1st and 3rd Thursday: 12:00 p.m. - 1:00 p.m.,56,-118.1239946,34.5795767
Food Resources,Various,SA Mayflower Gardens Senior Living Community,https://mayflowergardens.org/residential-living/,6570 Ave. L-12,"6570 Ave. L-12, Quartz Hill, 93536",Quartz Hill,93536,(661) 943-3228,Senior living community. Provides grocery deliveries to seniros citizens living in the community. Intake by phone.,57,-118.2475289,34.647622
Food Resources,Various,Salvation Army - Glendale,https://glendale-ca.salvationarmy.org/,300 East Angeleno Ave,"300 East Angeleno Ave, Burbank, 91502",Burbank,91502,(818) 246-5586,Mon-Fri: 12:00 p.m. - 3:00 p.m.. Must provide picture ID. If homeless no requirements.,58,-118.3058744,34.1812165
Food Resources,Various,Salvation Army - Inglewood,https://inglewood.salvationarmy.org/inglewood_corps/,324 E. Queen St,"324 E. Queen St, Inglewood, 90301",Inglewood,90301,(310) 677-3375,"Food Pantry days and hours are: Mon., Wed., & Fri: 1:00 pm. - 4:00 pm. No ID is required.",59,-118.3509888,33.9627428
Food Resources,Various,Salvation Army of Long Beach,https://www.salvationarmy-socal.org/southern-california/Contact,3000 Long Beach Blvd.,"3000 Long Beach Blvd., Long Beach, 90807",Long Beach,90807,(562) 247-3534 Quarantined Seniors call: 562-247-3528,"Services Provided Food Our Food Bank is OPEN. Here are our Hours: Mon-Wed-Fri 9:00 a.m - 4:00 p.m., (12-1 closed for lunch) - Thurs: 4:00 p.m. - 8:00 p.m.. We also are continuing to serve the Homeless with food bags on Tues: 9:00 a.m. - 4:00 p.m.. We are also delivering to self-quarantined seniors and those who cannot leave their homes. For deliveries, seniors and self-quarantined need to call: 562-247-3528.",60,-118.1893143,33.8118575
Food Resources,Various,Salvation Army-Lancaster,https://foodoasis.la/food-pantry/salvation-army-lancaster-corp/,44517 Sierra Hwy.,"44517 Sierra Hwy., Lancaster, 93550",Lancaster,93550,(661) 948-3418,"Wednesdays: 10:00 am - 12:00 pm. Must call in advance for pick up and bring ID, proof of address, proof of income if available, and original birth certificates if there are any children in the household.",61,-118.136292,34.6915357
Food Resources,Various,San Juan Diego Community Center,https://catholiccharitiesla.org/san-gabriel-region/,4171 N. Tyler Ave,"4171 N. Tyler Ave, El Monte, 91731",El Monte,91731,(626) 575-7652,Food pantry days and hours: Mon-Fri: 9:00 am - 12:00 pm. Must provide a picture ID.,62,-118.031897,34.0827886
Food Resources,Various,Sheperd's Pantry,https://www.shepherdspantry.com/locations-services/,13020 Francisquito Ave.,"13020 Francisquito Ave., Baldwin Park, 91706",Baldwin Park,91706,(626) 671-0090,Food pantry day and hours: Friday: 4:00 pm - 7:00 pm. Drive thru pick. Must bring ID.,63,-117.9894113,34.0788213
Food Resources,Various,Shepherd's Pantry,https://www.shepherdspantry.com/,"657 East Arrow Highway, Suite J","657 East Arrow Highway, Suite J, Glendora, 91740",Glendora,91740,(626) 852-7630,Wed-Thurs: 4:00 p.m. - 7:00 p.m.. Must provide Picture ID. Drive-thru pickup.,64,-117.8510611,34.1070744
Food Resources,Various,SHIELDS for Families Social Service Agency - Lynwood,https://www.shieldsforfamilies.org/,11705 Deputy Yamamoto Pl,"11705 Deputy Yamamoto Pl, Lynwood, 90262",Lynwood,90262,(323) 242-5000,10:00 a.m. - 2:00 p.m.. Arrive early.,65,-118.2288143,33.9269035
Food Resources,Various,St. Gregory Episcopal Church,http://stgregoryschurch.com/,6201 Willow St,"6201 Willow St, Long Beach, 90815",Long Beach,90815,(562) 420-1311,"Food Pantry day and hours: FIRST Wednesday of month: 9:30 am - 12:00 pm, or unitl food runs out. ID is required.",66,-118.1107591,33.8037303
Food Resources,Various,The Asian Youth Center,https://www.asianyouthcenter.org/,100 Clary Ave,"100 Clary Ave, San Gabriel, 91776",San Gabriel,91776,(626) 309-0622,By appointment: Mon. - Fri.: 8:00 am - 5:00 pm.,67,-118.1003346,34.0976158
Food Resources,Various,United Methodist Church,N/A,918 West Avenue J,"918 West Avenue J, Lancaster, 93534",Lancaster,93534,(661) 942-0419,Lunch provided Mondays and Thursdays: 12:00 p.m. (Meals to go only).,69,-118.1465086,34.68868
Food Resources,NE,Loaves and Fishes,https://foodoasis.la/food-pantry/loaves-fishes-van-nuys/,14640 Keswick St.,"14640 Keswick St., Van Nuys, 91405",Van Nuys,91405,(818) 997-0943,"Due to the Covid-19 virus, the pantry is temporarily closed this time.",73,-118.4523836,34.2100138
Food Resources,NE,Make It Happen,https://www.makingithappeninc.org/,11120 Ora Vista Ave,"11120 Ora Vista Ave, Sunland, 91040",Sunland,91040,(818) 398-6232,Food pantry day and hours: Saturday: 2:00 pm - until supplies run out. Grab and go meals: Sunday at 3:30 pm. No ID required.,74,-118.3154586,34.2713128
Food Resources,NE,Meet Each Need with Dignity,https://mendpoverty.org/,10641 N. San Fernando Rd,"10641 N. San Fernando Rd, Pacoima, 91331",Pacoima,91331,(818) 896-0246,Fri: 9:00 a.m. - 11:00 a.m.. Open to the homeless community only.,75,-118.4195049,34.26308470000001
Food Resources,NE,NOLP / North Hollywood,https://aplahealth.org/services/nolp-food-pantries-nutrition/,7336 Bellaire Avenue,"7336 Bellaire Avenue, North Hollywood, 91605",North Hollywood,91605,(213) 201-1600,Thurs: 10:30 a.m. - 5:30 p.m.,76,-118.4089623,34.2047177
Food Resources,NE,Our Lady of the Holy Rosary Church,http://www.olhr.org/,7800 Vineland Ave.,"7800 Vineland Ave., Sun Valley, 91352",Sun Valley,91352,(818) 765-3350,"Food baskets: Tues. & Fri.: 9:00 am -11:00 am. Closed this Friday, 4/10 for Good Friday.",77,-118.3699123,34.2124742
Food Resources,NE,RCCG Victory House of California,https://foodoasis.la/food-pantry/rccg-victory-house-of-california/,6640 Van Nuys Blvd.,"6640 Van Nuys Blvd., Van Nuys, 91411",Van Nuys,91411,(323) 385-4442,Please call for more information.,78,-118.448157,34.1918623
Food Resources,NE,Salvation Army - Van Nuys,https://sanfernandovalley.salvationarmy.org/,6300 Sepulveda Blvd.,"6300 Sepulveda Blvd., Van Nuys, 91401",Van Nuys,91401,(818) 901-1154,Food and utility assistance; call for assistance. Temporarily closed.,79,-118.4656838,34.1850497
Food Resources,NE,San Fernando Valley Rescue Mission,https://sfvrescuemission.org/,13422 Saticoy St.,"13422 Saticoy St., North Hollywood, 91605",North Hollywood,91605,(818) 785-4476,Call before going.,80,-118.425435,34.2085797
Food Resources,NE,Sova Kosher Food Pantry,https://www.jfsla.org/SOVA,16439 Vanowen St.,"16439 Vanowen St., Van Nuys, 91405",Van Nuys,91405,(818) 988-7682,"Mon. - Thurs.:10:00 am - 1:30 pm and Sundays: 9:00 am - 12:00 pm. Please take ID and proof of residence. Please check their website for zipcodes they serve and bring birth certificates for children. They will be closed this Wednesday, 4/8 and next Wednesday and Thursday, 4/15 and 4/16 in observance of Passover.",81,-118.491725,34.1942489
Food Resources,NE,St. Charles Service Center,http://www.scbnh.com/center.htm,10825 Moorpark St.,"10825 Moorpark St., North Hollywood, 91605",North Hollywood,91605,(818) 985-7365,Food Pantry days and hours: Tues. - Thurs. : 9:00 am. - 11:45 am. Please bring ID.,82,-118.3666293,34.150858
Food Resources,NE,St. Ferdinand Outreach Center,http://stferdinandchurch.org/ministries/outreach-center,1040 Coronel St.,"1040 Coronel St., San Fernando, 91340",San Fernando,91340,(818) 365-3194,"Food pantry is open every 2nd and 4th Friday of the month: 9:00 am - 11:00 am at 1044 Pico Blvd. San Fernando, CA 91340. No ID or documentation required at this time.",83,-118.4437635,34.2811925
Food Resources,NE,St. Vincent de Paul,N/A,7800 Vineland Blvd.,"7800 Vineland Blvd., Sun Valley, 91352",Sun Valley,91352,(818) 765-3350,Tues. and Fri.: 9:00 am -11:00 am. Services are on a walkin basis and no ID ir required at this time.,84,-118.3699123,34.2124742
Food Resources,NE,VIC Food Pantry,https://nmvic.org/get-involved/food-pantry/,6514 Sylmar Ave.,"6514 Sylmar Ave., Van Nuys, 91401",Van Nuys,91401,(818) 781-1101,Call before going.,85,-118.4463236,34.1890986
Food Resources,Various,Norwalk-La Mirada USD Preschool Program,https://www.nlmusdpreschool.org/apps/pages/index.jsp?uREC_ID=330986&type=d&pREC_ID=739127,12244 Rosecrans Ave,"12244 Rosecrans Ave, Norwalk, 90650",Norwalk,90650,(562) 210-4205 ext 4216,Assisting by providing meals parents can pick up.,86,-118.071389,33.9018691
Food Resources,NW,Burbank – Temporary Aid Center- B-TAC,https://www.burbanktemporaryaidcenter.org/,1304 West Burbank Boulevard,"1304 West Burbank Boulevard, Burbank, 91506",Burbank,91506,(818) 848-2822,Call for more information.,87,-118.3260815,34.182529
Food Resources,NW,"Catholic Charities of LA, Guadalupe Community Center",https://catholiccharitiesla.org/,21600 Hart St,"21600 Hart St, Canoga Park, 91303",Canoga Park,91303,(213) 251-3549,Mon. Wed. Fri. 9:00 a.m. - 12:00 p.m.. Once all food is gone they will be closed until further notice.,88,-118.6004808,34.1973598
Food Resources,NW,Congregational Church of Chatsworth,http://www.chatsworthucc.org/,20440 Lassen Street,"20440 Lassen Street, Northridge, 91324",Northridge,91324,(818) 998-2931,Call for more information.,89,-118.578855,34.2496062
